{
  "$schema": "./schemas/tb4_task_catalog.schema.json",
  "schema_version": "1.0",
  "dataset": "terminal-bench/terminal-bench",
  "dataset_ref": "sha256:39d9f44b40420cde8fdcc087579c0d72a7e14fa3656d603c3f0d22fb35e27732",
  "release": "v4.0.0",
  "task_count": 66,
  "gpu_tasks": [
    "fp8-rmsnorm-gemm",
    "jax-speedrun-gpu",
    "math-eval-grader"
  ],
  "compose_tasks": [
    "ctr-optimization",
    "cumulative-layout-shift",
    "freight-dispatch-shift",
    "heat-pump-warranty",
    "intrastat-meldung",
    "kv-live-surgery",
    "legacy-utility-triage",
    "live-database-cutover",
    "medical-claims-processing",
    "nextjs-performance",
    "payments-pipeline-fix"
  ],
  "sidecar_artifact_tasks": [
    "ctr-optimization",
    "heat-pump-warranty",
    "intrastat-meldung",
    "kv-live-surgery",
    "legacy-utility-triage",
    "live-database-cutover",
    "medical-claims-processing",
    "payments-pipeline-fix"
  ],
  "tasks": {
    "atrx-vep-crispr": {"digest": "sha256:4ebe9e13de8cbd39ee2f9e14a9d7b1233c047ae43fba238ebc6274465697be3a", "domain": "science", "subcategory": "biology", "coding_relevance": "domain", "capabilities": ["scientific-analysis", "structured-output"]},
    "batched-eval-parity": {"digest": "sha256:e1d54abdb0a83b6c28714fe54c5fd0cfe053132cf2a9d511a0166c6c556ea2be", "domain": "ml", "subcategory": "evaluation", "coding_relevance": "adjacent_engineering", "capabilities": ["python", "ml", "testing", "data"]},
    "biped-contact-dynamics": {"digest": "sha256:7d9120179572cbb6511108fcfa1e76e6bc1bb56f2cace8e606d4ccded15cb4c4", "domain": "science", "subcategory": "robotics", "coding_relevance": "adjacent_engineering", "capabilities": ["simulation", "numerical", "performance"]},
    "bun-sourcemap-leak": {"digest": "sha256:e55ae542f338f50f4468d940c7d7c93a45d34fd418dc6cc5883c1fedc753603a", "domain": "software", "subcategory": "systems", "coding_relevance": "core_swe", "capabilities": ["javascript", "debugging", "security", "build-tools"]},
    "cad-model": {"digest": "sha256:037b83651678230c04217bc7bd077c9e2c3d5a383bb368cdeb19e88a2202f644", "domain": "hardware", "subcategory": "cad", "coding_relevance": "adjacent_engineering", "capabilities": ["cad", "artifact", "geometry"]},
    "cargo-flight-dispatch": {"digest": "sha256:18a1c2670ce4be0e6752f48ed6c750281d7f97db025f5e74edc6c8728f62f5b5", "domain": "operations", "subcategory": "logistics", "coding_relevance": "domain", "capabilities": ["optimization", "structured-output", "planning"]},
    "coq-block-bound": {"digest": "sha256:4e2a6b608b18eeda1e18996efa115fec3573d90d4f798406b073b078fea52c89", "domain": "science", "subcategory": "math", "coding_relevance": "adjacent_engineering", "capabilities": ["formal-methods", "coq", "proof"]},
    "ctr-optimization": {"digest": "sha256:df8b7d99e23ad23ac9c92da35ff0a2714d78781e9424edd63143cc86860e096b", "domain": "operations", "subcategory": "marketing", "coding_relevance": "adjacent_engineering", "capabilities": ["optimization", "service", "compose", "marketing"]},
    "cumulative-layout-shift": {"digest": "sha256:d9805202ade29c603a55f5aa5af27a794a2ed3897e05e8ff0a484b4a84a0ed8a", "domain": "software", "subcategory": "frontend", "coding_relevance": "core_swe", "capabilities": ["frontend", "web", "performance", "compose"]},
    "data-anonymization": {"digest": "sha256:dec4261252665cf2981783df104ea10c901dcab3720b27b4bf8909a059713f08", "domain": "software", "subcategory": "data-engineering", "coding_relevance": "core_swe", "capabilities": ["data", "privacy", "python", "structured-output"]},
    "distributed-dedup": {"digest": "sha256:a645441376fea3d5b1acc15b64fe288eb0bb835724f6bf7a21adb1eca2bb814d", "domain": "software", "subcategory": "systems", "coding_relevance": "core_swe", "capabilities": ["distributed-systems", "algorithms", "performance", "python"]},
    "embedding-drift-monitor": {"digest": "sha256:6907ffce9ad5c8a8b41fe9c0a076a9aeb9754a2f8083c52f9aede5481a4f4c59", "domain": "ml", "subcategory": "inference", "coding_relevance": "adjacent_engineering", "capabilities": ["ml", "monitoring", "data", "python"]},
    "fin-saccr-rwa": {"digest": "sha256:bd0ee47169986cfdd4b0ccc98f461382c612e1301dd75f98d1381015eb25398a", "domain": "operations", "subcategory": "finance", "coding_relevance": "domain", "capabilities": ["finance", "quantitative", "structured-output"]},
    "foodstuff-beta-activity": {"digest": "sha256:52adca169e97e15fe8692986470b6556f478e7348a37c58739a5bdb3f02cc45a", "domain": "science", "subcategory": "chemistry", "coding_relevance": "domain", "capabilities": ["scientific-analysis", "numerical", "structured-output"]},
    "formal-crypto": {"digest": "sha256:cb4f5a280f6ac1bfcc6c919841810084e286ce3109969841e1f5739fe9f7acf7", "domain": "security", "subcategory": "cryptography", "coding_relevance": "adjacent_engineering", "capabilities": ["security", "cryptography", "formal-reasoning", "python"]},
    "fp8-rmsnorm-gemm": {"digest": "sha256:c071d986784369f0403ebf60070c7f96d7df3acc7e5a4614c986f8f421acda38", "domain": "ml", "subcategory": "kernels", "coding_relevance": "adjacent_engineering", "capabilities": ["ml", "cuda", "gpu", "performance"]},
    "freecad-impeller": {"digest": "sha256:40d322e979d30dd53c0a9330445b8799cf5c02099b0718a3b3ad15231b366dba", "domain": "hardware", "subcategory": "cad", "coding_relevance": "adjacent_engineering", "capabilities": ["cad", "geometry", "artifact"]},
    "freecad-platform-drawing": {"digest": "sha256:ed6db89260074bd0db58b064d90977cc4d470843deefecd8a9caf7f21da9a747", "domain": "hardware", "subcategory": "cad", "coding_relevance": "adjacent_engineering", "capabilities": ["cad", "geometry", "artifact"]},
    "freecad-spring-clip": {"digest": "sha256:c3110552902a44e17326df0a87083eb6028068cfbc7aa47461c7f2c0aa528bab", "domain": "hardware", "subcategory": "cad", "coding_relevance": "adjacent_engineering", "capabilities": ["cad", "geometry", "artifact"]},
    "freight-dispatch-shift": {"digest": "sha256:9c27972688139fce999058386bd381ca194c9f4ba76161a52bb8560aee9ceb2c", "domain": "operations", "subcategory": "logistics", "coding_relevance": "domain", "capabilities": ["compose", "optimization", "service", "planning"]},
    "glycan-ms2-elucidation": {"digest": "sha256:80bf0ef924d6ba9a4323172f5a13df1734609914ddd086deef2da0288e9c560d", "domain": "science", "subcategory": "chemistry", "coding_relevance": "domain", "capabilities": ["scientific-analysis", "data", "structured-output"]},
    "gsea-proteomics": {"digest": "sha256:7c0512e617cd4c0a0b595ebfb81258495d7e4a12c003cd0592c1137aa986a85d", "domain": "science", "subcategory": "biology", "coding_relevance": "domain", "capabilities": ["scientific-analysis", "data", "structured-output"]},
    "heat-pump-warranty": {"digest": "sha256:7ce04515367c33c3673d1e6dc387edfa9b5a2565e6f040b1d24626efc07d0ad7", "domain": "operations", "subcategory": "claims", "coding_relevance": "domain", "capabilities": ["compose", "service", "structured-output", "workflow"]},
    "hof-topology-interpenetration": {"digest": "sha256:2534e62c5ab3c8592f4e0de3dee14ff07a5c1c9434164e7f80e2f564273de014", "domain": "science", "subcategory": "chemistry", "coding_relevance": "domain", "capabilities": ["scientific-analysis", "geometry", "numerical"]},
    "html-js-filter": {"digest": "sha256:f211960f1f7c66ace91c3d079db073ed0f841d458db4cad1f2f943cba6cc79f3", "domain": "security", "subcategory": "appsec", "coding_relevance": "core_swe", "capabilities": ["security", "javascript", "web", "debugging"]},
    "interleaved-vigenere": {"digest": "sha256:238a75a32aad5e60b33a22ac53087790e95b752c6272f41d724407f198df4a14", "domain": "security", "subcategory": "cryptography", "coding_relevance": "adjacent_engineering", "capabilities": ["security", "cryptography", "algorithms"]},
    "intrastat-meldung": {"digest": "sha256:d944c51392857e886211327f38086513c0540b5c2f557b75b2b44dec209b8222", "domain": "operations", "subcategory": "compliance", "coding_relevance": "domain", "capabilities": ["compose", "service", "structured-output", "workflow"]},
    "jax-speedrun-gpu": {"digest": "sha256:b8ea491d376abbb0da944e7a3b0fdef710d6de76a85cd5e25d132a8a541748fe", "domain": "ml", "subcategory": "training", "coding_relevance": "adjacent_engineering", "capabilities": ["ml", "jax", "gpu", "performance"]},
    "ks-solver-cpp": {"digest": "sha256:d4eef6bb296028e57be0abb4b19dab71cf04b807cbe22fad4bc64174f9380cc0", "domain": "science", "subcategory": "physics", "coding_relevance": "adjacent_engineering", "capabilities": ["c++", "algorithms", "numerical", "performance"]},
    "kv-live-surgery": {"digest": "sha256:810958fbeefc6a7f677624f908561e6e47d88aec8c06fa5321d81f5aa75a9ffc", "domain": "software", "subcategory": "systems", "coding_relevance": "core_swe", "capabilities": ["distributed-systems", "service", "compose", "stateful"]},
    "lake-temp-glm": {"digest": "sha256:4ccec50699de5de3b1bcdedf1189a56d72520220da27306c10d93419a3316a0c", "domain": "science", "subcategory": "earth", "coding_relevance": "domain", "capabilities": ["scientific-analysis", "ml", "numerical", "structured-output"]},
    "layout-config-recreation": {"digest": "sha256:997003ffc98f6df316167de8752c9beada20cb1292588b0fa6409d87ed3a1def", "domain": "media", "subcategory": "design", "coding_relevance": "domain", "capabilities": ["design", "artifact", "structured-output"]},
    "layout-config-recreation2": {"digest": "sha256:193312b14b1dcb6ef551efff691cbb708b2032f58879b0b19efe88a2cddc9deb", "domain": "media", "subcategory": "design", "coding_relevance": "domain", "capabilities": ["design", "artifact", "structured-output"]},
    "legacy-utility-triage": {"digest": "sha256:d9954d3b78c8440a5927bc9826bfd9a61827391bf47f0885575fc7f27c4c8b6e", "domain": "operations", "subcategory": "claims", "coding_relevance": "domain", "capabilities": ["compose", "browser", "workflow", "structured-output"]},